keyword,created_at,user_id,text,relevante
división,2024-07-10 23:38:29+00:00,843963644157317121,El ascenso de Ollie Watkins: de jugar en segunda división a darle el pase a la final a Inglaterra en la Eurocopa 2024 https://t.co/xpCoHE17YZ,
división,2024-07-10 23:37:38+00:00,1958538092,"José Luis ""Garrafa ""Sánchez (Buenos Aires; 26 de mayo de 1974 - Laferrere; 8 de enero de 2006) fue un jugador del fútbol profesional de Argentina. Jugó en diversos clubes de las divisiones de ascenso en la Argentina, así como también en la Primera División Argentina y en Uruguay. https://t.co/ve6ObMv19b",
territorio mexicano,2024-07-10 23:22:47+00:00,3849595874,@GuiaDeportiva9 También en Territorio Mexicano pero TUDN MEX lo borro,
territorio mexicano,2024-07-10 23:12:14+00:00,3871232234,| #Deportes | El FC Barcelona abrirá su segunda Barça Academy en territorio mexicano. La primera se inauguró en 2020 y está en #CiudadDeMéxico y la segunda abrirá sus puertas en #Querétaro. #ElFuturoEsHoy https://t.co/BuW1cvrCkv,
territorio mexicano,2024-07-10 22:42:34+00:00,1580755925312348161,"@DavidGo38098124 @Polemista4T @mujerlunabella @sr_indomable @JCTigreSalcido @martibatres El reglamento del metro se tiene que acoplar a lo que diga la constitución pq el metro no es un espacio fuera de territorio mexicano, todo lo que pase dentro se acopla a las reglas de la constitución, no es ningún vacío legal, hay q aprender un poquito de leyes antes de hablar",
territorio mexicano,2024-07-10 22:34:59+00:00,1641177661295738881,"@RockHoound @SanMarinoTeam flaco, no opines si sos Mexicano, Estados Unidos te robó medio territorio y lo más inteligente que hizo tu país fue empezar a lamerles el culo, que triste tu país

Argentina tiene sentido de pertenencia y amor propio, no le chupamos el culo a los piratas que nos robaron",
territorio mexicano,2024-07-10 22:15:44+00:00,889227076120698880,"Estamos en un México muy bizarro, esta persona por aventar un gato puede  pasar varios años en la cárcel mientras hay un CO en el territorio mexicano matando hasta menores de edad y ni siquiera los buscan...

Algo está muy raro en esto. https://t.co/8OHQ3vhFsC",
territorio mexicano,2024-07-10 21:49:21+00:00,127733150,@RogerEthizs @Liatanis @RoiLopezRivas Ahhh ya vi que eres un lamezuelas del AMLO pregúntale entonces porque rechazo que la CIA hiciera investigaciones en territorio Mexicano? Que detuvieran a sus compas en Estados Unidos? 🤡,
territorio mexicano,2024-07-10 21:15:03+00:00,43926196,SSN registra sismo de 4.6 con epicentro en Oaxaca; en lo que va del día se han registrado 38 en territorio mexicano https://t.co/7Ml5BVvM4x,
territorio mexicano,2024-07-10 20:19:52+00:00,35914963,"🇲🇽 | El economista y abogado Antonio García explicó que la reforma judicial causaría el mismo daño al país que la Guerra del 47, cuando perdimos la mitad de su territorio. #YoSíInfluyo https://t.co/9EfDtdebzZ",
territorio mexicano,2024-07-10 20:14:45+00:00,1032892291,"@BlueLikeThe_Sky @javierbaez_ Población adulta mayor existente en todo el territorio mexicano: que ocupe/viva/coexista dentro del ya mencionado Estados Unidos Mexicanos.

Aclaración*",
territorio mexicano,2024-07-10 20:10:20+00:00,898329999421435908,"EU aumenta los aranceles sobre el acero y el aluminio importados a través de México

Las tarifas afectarían a los metales importados a través de territorio mexicano pero fundidos o vertidos en China, Rusia, Bielorrusia o Irán.

https://t.co/ebf11p3sig https://t.co/ha8TIjZeER",
límite sur,2024-07-10 19:27:52+00:00,1811039238412206080,"Mulino se comprometió públicamente a cerrar las vías de acceso del ""Tapón del Darién"", lugar por el que entran cientos de miles de inmigrantes de forma irregular año tras año. Se encuentra al sur del país, en el límite fronterizo con Colombia. https://t.co/upuqxlgmkS",
límite sur,2024-07-10 18:30:50+00:00,31418919,"La ley romana decía que un general no podía entrar en Italia con tropas y el límite era el río Rubicón.

Del Rubicón al norte, provincias.
Del Rubicón al sur, Roma.

Cruzarlo con tropas era un acto de guerra y César lo sabía, así que consideró sus chances y arrojó el dado. https://t.co/2O7yiQXIY0",
límite sur,2024-07-10 15:35:03+00:00,2430214837,@Estebansh27 @Mallus_Malleus @U_Kaffeekanne La cosa no funciona como la doctrina Zukhov. Dicen que el óptimo de Pareto aplicado a las bajas del 20% es el límite para la descomposición de cualquier organización humana. Pero diría que es más bajo. Ejemplo: Guerra civil americana. El sur con 9 millones tuvo 493K de bajas.,
límite sur,2024-07-10 13:22:18+00:00,1184240996848193539,"El Sørvágsvatn o Leitisvatn, es el mayor lago de las Islas Feroe Dinamarca. En su límite norte próximo al centro geográfico de la isla Vágar, se encuentra el pueblo de Vatnsoyrar en el sur el lago desagua en la cascada Bøsdalafossur q cae directamente al mar desde 30 m de altura. https://t.co/PGBnjKmNyK",
límite sur,2024-07-10 12:24:29+00:00,304927733,"@meteosanjuan Efectivamente. Muy al límite una vez avance la noche. O gana el NO (terral) y la temperatura baja lentamente, o gana el giro del viento a Sur que se puede canalizar por el valle (el que hace bajar rápido la temperatura sobre la medianoche de algunos días). Luego lo comprobamos 👍🏻 https://t.co/nigOyhssOT",
límite sur,2024-07-10 10:11:50+00:00,2780395189,"@WarrenBuffett El límite sur de la meseta de Colorado es el escarpe de Mogollon Rim, cubierto por caliza Kaibab de la era Pérmica y arenisca Coconino, que se eleva a una altitud de unos 3000 pies en el área de transición entre la meseta de Colorado y los condados de Basin and Range.",
límite sur,2024-07-10 04:00:01+00:00,137104854,"La subida de las detenciones en 🇲🇽 un 219% contrasta con la ligera bajada de las mismas cifras en la frontera sur de 🇺🇸. En el límite entre los dos países, la #patrullafronteriza estadounidense ha tenido 905.936 encuentros con #migrantes en los primeros cinco meses del año, una… https://t.co/2APkwnld5z",
límite sur,2024-07-10 02:55:21+00:00,251386179,"@PogotaConcerts @BreakfastLiveCo @FnixColomb15751 Pero me la pelan, cómo mierdas no dejan límite para cada categoría de la preventa... ahora no se puede ni fan sur, ni norte a ver si dejan platea 🥺",
límite sur,2024-07-10 02:30:07+00:00,1193575399067963399,"El gobernador está exclusivamente para robar. Su INEPTITUD, RATERISMO y CORRUPCIÓN no tienen límite, es morenista.
“Esa puede ser la causa de que nos estamos enfermando”: el agua rebasa niveles de arsénico en comunidad de Baja California Sur https://t.co/IsVz6QGLBG",
límite sur,2024-07-09 19:34:29+00:00,4411254867,"@thecliniccl Está tan necesitado el gobierno que de verdad le prohibirá el uso de leña a las personas en el sur con el sólo motivo que deban ir por parafina.
De verdad ya se pasaron del límite con esto, es el colmo que estos comunistas basura y asqueroso hagan esa estupidez...",
límite norte,2024-07-10 22:56:33+00:00,590207490,"eran mapas de Entre Ríos, y estaba ahí, marcada en una punta de la costa occidental, Paraná, la ciudad en la que nací. Al norte, casi en el límite con Misiones, encontré Chajarí, la ciudad donde vive toda mi familia paterna y que visitábamos todos los veranos, por joder durante",
límite norte,2024-07-10 19:20:26+00:00,80967921,"#ReporteCiudadano | Vecinos de la calle 15 Norte se ven vulnerables ante la falta de topes en la zona; aseguran que los automovilistas no respetan el límite de velocidad ✋🚸

Con información de @RoverCastillo https://t.co/Nhm9OPlq1v",
límite norte,2024-07-10 18:30:50+00:00,31418919,"La ley romana decía que un general no podía entrar en Italia con tropas y el límite era el río Rubicón.

Del Rubicón al norte, provincias.
Del Rubicón al sur, Roma.

Cruzarlo con tropas era un acto de guerra y César lo sabía, así que consideró sus chances y arrojó el dado. https://t.co/2O7yiQXIY0",
límite norte,2024-07-10 17:38:27+00:00,215032084,"#ABCNoticias

El albergue de la Secretaría de Emergencia Nacional, ubicada en la Costanera Norte, albergó este fría madrugada de miércoles a 58 personas. Este número sobrepasó al límite del refugio (que es de 50), por lo que se tuvo que ampliar su capacidad.

#MovilABC - Brian… https://t.co/KJfg1Tl1fD https://t.co/6t8YmByCBI",
límite norte,2024-07-10 13:22:18+00:00,1184240996848193539,"El Sørvágsvatn o Leitisvatn, es el mayor lago de las Islas Feroe Dinamarca. En su límite norte próximo al centro geográfico de la isla Vágar, se encuentra el pueblo de Vatnsoyrar en el sur el lago desagua en la cascada Bøsdalafossur q cae directamente al mar desde 30 m de altura. https://t.co/PGBnjKmNyK",
límite norte,2024-07-10 05:49:43+00:00,1567891805949026305,"@HermogenesPdA Y Bachelet¿no fue tmb la q hizo sacar las minas antipersonales en el límite Norte d Chile y x esa tremenda extensión casi imposible d controlar,se nos han pasado las peores bandas d ls peores criminales d toda Sudamérica?Mujer maldita q ha logrado engañar a tantos q no la conocen",
límite norte,2024-07-10 02:55:21+00:00,251386179,"@PogotaConcerts @BreakfastLiveCo @FnixColomb15751 Pero me la pelan, cómo mierdas no dejan límite para cada categoría de la preventa... ahora no se puede ni fan sur, ni norte a ver si dejan platea 🥺",
límite norte,2024-07-09 23:33:55+00:00,2701106364,"@pefier @cadamlot En el norte de Rusia hay una ciudad de unos 300 mil habitantes donde en el invierno hay -70º, el límite para que los niños vayan a la escuela son -50º...tengo un amigo escocés que iba a la escuela de pantalón corto con -35º...",
límite norte,2024-07-09 22:11:40+00:00,754064273815502852,"@ecuadoreno @IGecuador En efecto estimado Francisco, lo más probable es que dichos sonidos fueron originados desde el mismo volcán mencionado, de tratarse en la zona norte del país también es posible que se trate del Volcán Chiles en el límite Ecuador - Colombia. 🤝🏻🇪🇨🇨🇴🌋",
límite norte,2024-07-09 18:38:45+00:00,215836080,"Esta escultura en basalto representa a un puma, animal considerado por los mexicas como representante del Sol por el color de su pelaje. La pieza fue hallada en el límite norte del Recinto Sagrado.
Conócela en la Sala 6 ""Flora y Fauna"". https://t.co/vCvLaBvo2d",
ciudad de Tijuana,2024-07-10 22:36:58+00:00,836826775460118528,@TercerIncomodo En cambio los de Tijuana juntándose en las hermosas playas de San Diego y su buena ciudad . https://t.co/dkZQVCvFv9,
ciudad de Tijuana,2024-07-10 21:07:36+00:00,264557827,"La primera delegación es 🏛️Centro.
Viven 101,432 personas en 25km2.
En ella se estableció el trazo original de la ciudad en 1889 y creció como centro, conectado principalmente a San Diego.

Hoy es la sede del ayuntamiento, como también centro económico y cultural de #Tijuana https://t.co/AOOXIFEIyU",
ciudad de Tijuana,2024-07-10 21:07:33+00:00,264557827,"Este 11 de julio, #Tijuana cumplé 135 años, y con ella todas sus delegaciones. Sus ""mini ciudades"" dentro de la ciudad-municipio mas poblada de México (1.9 millones de personas, 2020).

Pero, ¿Delegaciones? ¿mini ciudades? ¿¡2millones!?¿queeeeee?
🧵 https://t.co/FC9dxoVBwF",
ciudad de Tijuana,2024-07-10 20:50:00+00:00,1792715342378393600,"¡Disfruta de un vuelo sencillo a Puebla, Los Mochis, Morelia, Aguascalientes o Ciudad Obregón saliendo de Tijuana! 🌍✈️

Para más detalles y reservas, contáctanos a nuestros números oficiales. ¡No te pierdas esta oportunidad! 🛫📞
#Puebla #LosMochis #Morelia #Aguascalientes #Más https://t.co/BRJ9vXlKpG",
ciudad de Tijuana,2024-07-10 20:34:15+00:00,1792715342378393600,"¡Disfruta de un vuelo sencillo a México, Bajío, Hermosillo, Los Cabos, Tepic, Ciudad Juárez, Chihuahua o a México llegando al AIFA saliendo de Tijuana! 🌍✈️

Para más detalles y reservas, contáctanos a nuestros números oficiales. ¡No te pierdas esta oportunidad! 🛫📞
#México https://t.co/i9nCIq574X",
ciudad de Tijuana,2024-07-10 20:00:01+00:00,1176867875744649216,"""Venir a ayudar a todas esas personas que salen de sus países, dejando todo atrás, trayendo todas las ilusiones y abriéndose camino en una ciudad nueva"". Irma, participante de la 3ra carrera Tijuana #ConLasPersonasRefugiadas. https://t.co/Vlgus3UrUt",
ciudad de Tijuana,2024-07-10 19:51:42+00:00,1088251941883469827,"Nuestro socio de la Ciudad de #Tijuana Lic. Jorge Alberto Pickett Corona, nos informa que: Impiden fallas en sistema del SAT cumplir con obligaciones fiscales.

#ASA #Bajacalifornia 
#SAT #Tijuana 
#contribuyentes 
#obligacionesfiscales 

https://t.co/edJxlUC3kQ",
ciudad de Tijuana,2024-07-10 17:07:39+00:00,1650663451373494273,"#ClimaTijuana

Continúan las temperaturas cálidas en la ciudad de Tijuana 

Para este miércoles 10 de julio, las temperaturas máximas se pronostican entre los 31 grados centígrados con una mínima 18 de grados centígrados. 

📸 Chris Noyola / Border Zoom https://t.co/yGUeuAFysc",
ciudad de Tijuana,2024-07-10 16:00:00+00:00,268483097,"¿SALISTE DE TIJUANA? ¡AÚN PODRÁS SER PARTE DE EXPEDICIÓN DE VERANO!

Si ya saliste de la ciudad, saldrás o estarás de regreso pero quieres vivir  la #ExpedicionDeVerano en #ElTrompo, a partir de la segunda semana habrá opción semanal para los pequeños de 5 a 12 años.
(1/2) https://t.co/BEWyYuj5AN",
ciudad de Tijuana,2024-07-10 16:00:00+00:00,1444351652,"¡Garantizamos los derechos de las niñas, niños y adolescentes fuera de nuestras fronteras! 💙

Tenemos oficinas CONAPINA en sedes consulares de Monterrey, Ciudad Juárez, Tijuana y Tapachula, México; así como también en McAllen en el Estado de Texas, Estados Unidos. https://t.co/9O3hbQUhoX",
grupo,2024-07-10 23:41:32+00:00,1264368084011319301,"@marineritamar Entonces, qué diría el grupo go o no go 🪽",
grupo,2024-07-10 23:41:32+00:00,15793783,@fdzzz2921025122 @CHUCKY_MUSTAINE Se ve una banda de aweonaos/as fanáticos/as incapaces de entender que la resolución es consecuencia de la decisión política del Ministerio del Interior de apelar. De grupo de votantes no se ve mucho la verdad,
grupo,2024-07-10 23:41:30+00:00,1267434985,"@G100_23 Pero en el grupo no pasaste qué pasó? Ahora también es culpa de argentina que no pasarán, son horribles mapuches hdp!!! Dejen de llorar que se  parecen a los mexicanos",
grupo,2024-07-10 23:41:26+00:00,1789970629980008448,"Mi otra pasión, no parecer que esta es la cuenta de un grupo de música.",
grupo,2024-07-10 23:41:20+00:00,1602815977707773953,@JLBG80 @gopb15 @ANIABELLO_R Las FARC no son un grupo terrorista?… ni no son parte ahora de nuestro gobierno?.. el M19 no era un grupo terrorista?.. no forman una gran parte ahora del gobierno?… La realidad no es algo suyo.. no?,
grupo,2024-07-10 23:41:19+00:00,246676385,Tal cual... Un grupo de colonos apoyado por un grupo mafioso cuyo capo mayor es EEUU... https://t.co/2gldfDjT51,
